{
  "$schema": "m12-sqlserver-passive-contract.v1.schema.json",
  "schemaVersion": 1,
  "contractId": "m12-sqlserver-passive",
  "producerId": "m12-sqlserver-harness",
  "operationalMode": "passive",
  "platform": "windows",
  "supportedMajorVersions": [15, 16, 17],
  "assetBundles": {
    "m4-core-health": "10ef6cb84001d6a3f34889cb8c2d96d51c247289582ef3fa25c3f63862399a17",
    "m5-activity": "d233698a8b350ebdf805cbb65b085b0a93b64fc66f57f8f21d354c3445ee00c8",
    "m6-deadlocks": "57fa05f859d8f1e355786b84cc0ea6c05810ace0088fe176120b6ba019a654de",
    "m7-query-performance": "1f1afa0fe152ff21f01782192bfbab5585da4e408cb2122df9975feb30bdec11",
    "m9-operational-health": "ce5cf58bf6442b561426b7e72b7825c3e08093e80e5277f2ec6a93ddece6ba87",
    "m10-replication": "e9d52f49d1c728ed6968867a1caee11d6a5f288c5326da585b68a9bed0060f36"
  },
  "collectors": [
    { "collectorId": "engine.core", "executionOrder": 1, "assetVersion": 2, "supportedMajorVersions": [15, 16, 17] },
    { "collectorId": "database.inventory", "executionOrder": 2, "assetVersion": 2, "supportedMajorVersions": [15, 16, 17] },
    { "collectorId": "database.files", "executionOrder": 3, "assetVersion": 2, "supportedMajorVersions": [15, 16, 17] },
    { "collectorId": "activity.sessions", "executionOrder": 4, "assetVersion": 2, "supportedMajorVersions": [15, 16, 17] },
    { "collectorId": "activity.requests", "executionOrder": 5, "assetVersion": 2, "supportedMajorVersions": [15, 16, 17] },
    { "collectorId": "waits.server", "executionOrder": 6, "assetVersion": 2, "supportedMajorVersions": [15, 16, 17] },
    { "collectorId": "blocking.current", "executionOrder": 7, "assetVersion": 2, "supportedMajorVersions": [15, 16, 17] },
    { "collectorId": "deadlocks.system-health", "executionOrder": 8, "assetVersion": 1, "supportedMajorVersions": [15, 16, 17] },
    { "collectorId": "queries.performance", "executionOrder": 9, "assetVersion": 1, "supportedMajorVersions": [15, 16, 17] },
    { "collectorId": "backups.status", "executionOrder": 10, "assetVersion": 1, "supportedMajorVersions": [15, 16, 17] },
    { "collectorId": "sql-agent.failures", "executionOrder": 11, "assetVersion": 1, "supportedMajorVersions": [15, 16, 17] },
    { "collectorId": "tempdb.health", "executionOrder": 12, "assetVersion": 1, "supportedMajorVersions": [15, 16, 17] },
    { "collectorId": "availability-groups.health", "executionOrder": 13, "assetVersion": 1, "supportedMajorVersions": [15, 16, 17] },
    { "collectorId": "replication.health", "executionOrder": 15, "assetVersion": 1, "supportedMajorVersions": [15, 16, 17] }
  ],
  "mutationPolicy": { "passiveMutation": false, "allowMutationTokens": false, "snapshotRequired": true }
}
